timestamp,meal_type,food_consumed,optional_notes
2024-04-03 08:00:00,Breakfast,Scrambled eggs with toast,
2024-04-03 12:30:00,Lunch,Grilled chicken salad,
2024-04-03 18:00:00,Dinner,Spaghetti carbonara,
2024-04-04 08:30:00,Breakfast,Yogurt with granola and berries,
2024-04-04 12:00:00,Lunch,Quinoa salad with roasted vegetables,
2024-04-04 17:30:00,Dinner,Grilled salmon with steamed asparagus,
2024-04-05 07:45:00,Breakfast,Avocado toast with poached eggs,
2024-04-05 12:15:00,Lunch,Tuna salad sandwich,
2024-04-05 18:30:00,Dinner,Chicken stir-fry with rice noodles,
2024-04-06 08:00:00,Breakfast,Oatmeal with sliced banana,
2024-04-06 12:30:00,Lunch,Spinach and feta omelette,
2024-04-06 19:00:00,Dinner,Beef tacos with salsa and guacamole,
2024-04-07 08:15:00,Breakfast,Smoothie with spinach banana and almond milk,
2024-04-07 13:00:00,Lunch,Caesar salad with grilled chicken,
2024-04-07 18:45:00,Dinner,Shrimp scampi with garlic bread,
2024-04-08 07:30:00,Breakfast,Pancakes with maple syrup,
2024-04-08 12:45:00,Lunch,Chicken Caesar wrap,
2024-04-08 19:15:00,Dinner,Beef stir-fry with broccoli and rice,
2024-04-09 08:00:00,Breakfast,Bagel with cream cheese and smoked salmon,
2024-04-09 13:15:00,Lunch,Quinoa and black bean burrito bowl,
2024-04-09 18:30:00,Dinner,Grilled steak with mashed potatoes,
2024-04-10 07:45:00,Breakfast,Scrambled eggs with spinach and tomatoes,
2024-04-10 12:30:00,Lunch,Salmon avocado sushi rolls,
2024-04-10 19:00:00,Dinner,Chicken Alfredo pasta,
2024-04-11 08:30:00,Breakfast,Fruit smoothie bowl with granola,
2024-04-11 12:00:00,Lunch,Caprese salad with balsamic glaze,
2024-04-11 17:45:00,Dinner,Stuffed bell peppers with quinoa,
2024-04-12 07:30:00,Breakfast,Breakfast burrito with eggs beans and salsa,
2024-04-12 13:00:00,Lunch,Turkey and avocado wrap,
2024-04-12 18:15:00,Dinner,Salmon teriyaki with stir-fried vegetables,
2024-04-13 08:00:00,Breakfast,Yogurt parfait with mixed berries and granola,
2024-04-13 12:45:00,Lunch,Greek salad with grilled chicken,
2024-04-13 19:30:00,Dinner,Beef burger with sweet potato fries,
2024-04-14 07:45:00,Breakfast,Banana pancakes with maple syrup,
2024-04-14 12:30:00,Lunch,Quinoa and vegetable stir-fry,
2024-04-14 18:45:00,Dinner,Grilled shrimp with pineapple salsa,
2024-04-15 08:15:00,Breakfast,Avocado toast with scrambled eggs,
2024-04-15 13:00:00,Lunch,Cobb salad with grilled shrimp,
2024-04-15 19:15:00,Dinner,Chicken fajitas with peppers and onions,
2024-04-16 07:30:00,Breakfast,Oatmeal with almond butter and honey,
2024-04-16 12:15:00,Lunch,Tuna Nicoise salad,
2024-04-16 18:30:00,Dinner,Spicy pork tacos with pineapple salsa,
2024-04-17 08:00:00,Breakfast,Smoothie bowl with mixed fruits and chia seeds,
2024-04-17 13:30:00,Lunch,Chicken Caesar salad wrap,
2024-04-17 19:00:00,Dinner,Salmon with roasted vegetables and couscous,
2024-04-18 07:45:00,Breakfast,Scrambled eggs with smoked salmon,
2024-04-18 12:45:00,Lunch,Caprese sandwich with pesto,
2024-04-18 18:15:00,Dinner,Stuffed mushrooms with quinoa and spinach,
2024-04-19 08:30:00,Breakfast,Breakfast tacos with scrambled eggs and avocado,
2024-04-19 13:00:00,Lunch,Asian noodle salad with tofu,
2024-04-19 19:30:00,Dinner,Beef and broccoli stir-fry with rice,
2024-04-20 07:30:00,Breakfast,Banana smoothie with protein powder,
2024-04-20 12:30:00,Lunch,Sushi platter with assorted rolls,
2024-04-20 18:45:00,Dinner,Grilled chicken with quinoa and roasted vegetables,
2024-04-21 08:15:00,Breakfast,Yogurt with honey and mixed berries,
2024-04-21 13:15:00,Lunch,Mediterranean salad with grilled lamb,
2024-04-21 19:00:00,Dinner,Spaghetti squash with marinara sauce and meatballs,
2024-04-22 07:45:00,Breakfast,Pancakes with fresh fruit and whipped cream,
2024-04-22 12:00:00,Lunch,Veggie wrap with hummus,
2024-04-22 18:30:00,Dinner,Shrimp and vegetable curry with basmati rice,
2024-04-23 08:30:00,Breakfast,Scrambled eggs with spinach and feta,
2024-04-23 13:30:00,Lunch,Caesar salad with grilled shrimp,
2024-04-23 19:15:00,Dinner,Chicken parmesan with spaghetti,
2024-04-24 07:30:00,Breakfast,Fruit salad with yogurt and granola,
2024-04-24 12:45:00,Lunch,Chicken quesadilla with guacamole,
2024-04-24 18:00:00,Dinner,Beef stew with crusty bread,
2024-04-25 08:15:00,Breakfast,Avocado toast with poached eggs and tomato,
2024-04-25 13:00:00,Lunch,Soba noodle salad with peanut dressing,
2024-04-25 19:30:00,Dinner,Pork chops with roasted potatoes and green beans,
2024-04-26 07:45:00,Breakfast,Omelette with mushrooms spinach and cheese,
2024-04-26 12:30:00,Lunch,Turkey club sandwich,
2024-04-26 18:15:00,Dinner,Salmon teriyaki with jasmine rice and broccoli,
2024-04-27 08:00:00,Breakfast,Smoothie bowl with mixed berries and almond milk,
2024-04-27 13:15:00,Lunch,Greek salad with grilled chicken,
2024-04-27 19:00:00,Dinner,Beef stir-fry with peppers and snow peas,
2024-04-28 07:30:00,Breakfast,Oatmeal with banana and walnuts,
2024-04-28 12:45:00,Lunch,Chicken Caesar wrap,
2024-04-28 18:30:00,Dinner,Grilled steak with roasted vegetables and potatoes,
2024-04-29 08:15:00,Breakfast,Bagel with cream cheese and smoked salmon,
2024-04-29 13:30:00,Lunch,Quinoa salad with grilled vegetables,
2024-04-29 19:15:00,Dinner,Shrimp scampi with garlic bread,
2024-04-30 07:45:00,Breakfast,Breakfast burrito with eggs beans and salsa,
2024-04-30 12:00:00,Lunch,California sushi rolls,
2024-04-30 18:00:00,Dinner,Chicken Alfredo pasta,
